{
  "employee": {
    "id": "team-answer",
    "displayName": "Team Answer",
    "profile": "answer-agent"
  },
  "runtime": {
    "readOnly": true,
    "topK": 4,
    "minScore": 0.03
  },
  "model": {
    "provider": "extractive"
  },
  "sources": [
    {
      "id": "demo-handbook",
      "type": "filesystem",
      "root": "../examples/knowledge",
      "include": [
        ".md",
        ".txt"
      ]
    }
  ],
  "escalation": {
    "threshold": 0.18,
    "message": "I could not find enough approved evidence. Please ask a maintainer."
  }
}
